game_id,agent_id,model,survived,was_winner,game_outcome,total_rounds,reflection,round1_decision,simulation_folder
20251210_015904,C,openai/gpt-5.1,True,True,SUCCESS,1,"Over these recent games, the “volunteer early on easy puzzles” strategy kept working extremely well. Whenever my own puzzle was trivial arithmetic and the others had strong histories, volunteering in Round 1 with the unverified capsules (Q1-A, Q2-B, Q3-C, Q4-D) led to instant escapes and let me preserve all 4 coins every time. A and B’s choice to spend coins verifying (mainly D, sometimes me) only reduced the already tiny chance of a team error, while I benefited without paying.

What consistently did *not* add value for me was Round 1 verification. I’ve now seen clearly that verifying in Round 1 does not change the key risk: if no one volunteers, there is still a 25% random-death chance. On simple arithmetic with highly reliable teammates, the probability of a wrong password is well below that 25%, so paying coins to verify is mostly a psychological comfort, not a rational survival move.

Mechanically, I’ve learned to frame every decision as: “Is the chance the team password is wrong higher or lower than the 25% random-death risk?” Verifications only affect the former, never the latter. I’ve also seen that repeated multi-endorsements (like Q4-D+A+B and Q3-C+A) provide strong evidence of long-run reliability, which justifies even more trust on future easy rounds.

Next time, I’ll continue volunteering immediately on straightforward puzzles with proven teammates. I’ll only deviate—by verifying first or even passing—when puzzles look genuinely tricky, reliability patterns worsen, or conflicting endorsements appear, i.e., when the team-mistake risk starts to rival or exceed that 25% random-death risk.","Volunteer: Q1-A, Q2-B, Q3-C, Q4-D",rough_start_high_reflection_max_20251210_012625
20251210_015904,D,dummy,True,False,SUCCESS,1,[No reflection - reflection_mode is 'none'],Pass,rough_start_high_reflection_max_20251210_012625
20251210_034821,A,openai/gpt-5.1,True,False,SUCCESS,1,"In these recent games I kept using the same pattern: spend 1 coin to verify Q4, let B verify Q3, and rely on C to volunteer. That strategy clearly worked in the narrow sense: we escaped in Round 1 every time, nobody died, and my own risk never went above the random-elimination baseline. Targeted verification of the “weakest” capsule (historically D/Q4) was still enough to make the password safe for a volunteer.

However, the choice of Q4 became automatic. By this point D’s *current* accuracy is indistinguishable from B’s and C’s, so treating Q4 as the permanent weakest link is no longer well‑justified. I also continued to free‑ride on C’s willingness to volunteer, letting the risk and coin-variance sit with them while I stabilized at 3 coins.

Mechanically, these games reinforced that:
- Verification buys information and redistributes coins, but does not change random-death odds.
- With easy puzzles and mostly reliable players, one independent check per capsule is “enough”; anything beyond that is usually wasted coins.
- Stable role patterns (A verifies D, B verifies C, C volunteers) become self-reinforcing and can lull you into not re-evaluating.

Next time, I still plan to verify early, but I’ll pick the target dynamically: whichever capsule is least supported *in that specific game*, not Q4 by default. And once each capsule is either cross-checked or held by a consistently accurate player, I’ll be more willing to volunteer myself instead of always assuming C will take on that role.",Verify: Q4,rough_start_high_reflection_max_20251210_030955
20251210_034821,B,openai/gpt-5.1,True,False,SUCCESS,1,"What worked  
In Games 6–11, the same core strategy kept paying off: spend 1 coin in Round 1 to verify a singly-endorsed capsule (Q3), while expecting A to mirror this on Q4. That quickly turned two weak links into double-checked answers. With at least half the password redundant, C reliably volunteered to enter the code, so we escaped in a single round and I kept most of my coins. Avoiding volunteering myself while all four capsules were only singly-endorsed also remained crucial; it prevented me from absorbing the collective risk.

What didn’t work (or would have been bad)  
Although I didn’t actually try them this time, the same dominated options were clearly worse:  
- Volunteering before there’s redundancy on other capsules.  
- Passing in Round 1, which adds no information but still exposes me to random death if nobody volunteers.

What I learned about the mechanics  
These games reinforced that one well-placed verification is highly leveraged: a single coin can shift the group from “nobody should rationally volunteer” to “someone is comfortable taking the risk.” Public history creates stable roles: I’ve become a consistent verifier, A a complementary verifier, and C the finisher. Even with trivial arithmetic questions, the main challenge is coordinating risk, not solving puzzles.

What I’ll do differently next time  
I’ll keep defaulting to an early, targeted verification when capsules are singly-endorsed, but stay alert to changes:  
- If A or C stop following the expected pattern, I may need to verify a different capsule or be ready to volunteer once enough redundancy exists.  
- If I’m sitting on relatively more coins than others and we already have strong redundancy, I should consider volunteering rather than dragging the game out and increasing exposure to random death.",Verify: Q3,rough_start_high_reflection_max_20251210_030955
20251210_034821,C,openai/gpt-5.1,True,True,SUCCESS,1,"Across these games, the “immediate volunteer” strategy clearly worked best. Each time my own puzzle was trivial arithmetic and there was still a perfect record of correct capsules, I volunteered in Round 1 using Q1-A, Q2-B, Q3-C, Q4-D. This consistently produced instant escapes, no deaths, and full coin preservation for me. A and B continued to spend their own coins verifying others, giving the group extra safety at no cost to me.

By contrast, the earlier “verify first” approach proved inefficient and strategically misguided. Verification consumed coins while failing to address the dominant risk: a no‑volunteer round triggering a random death. Given the observed history (simple puzzles, zero wrong capsules, and cautious behavior from A/B and D), the probability of an incorrect password was much lower than the probability that everyone hesitates.

From this, I’ve learned:

- The key mechanic is the trade‑off between action and inaction: the game punishes hesitation more than confident play when puzzles are easy.
- Coins spent on verification only make sense when there is meaningful uncertainty about answer accuracy.
- Stable player roles emerge: A and B as verifiers, D as non‑volunteer, and me as the default first mover.

Next time, I’ll continue defaulting to early volunteering when:
1) My own puzzle is easy,  
2) There is no history of wrong capsules, and  
3) Other players remain hesitant.

I’ll only shift toward verification or caution if puzzle complexity increases, conflicting answers appear, or I see the first actual wrong capsule—signals that the underlying risk profile has changed.","Volunteer: Q1-A, Q2-B, Q3-C, Q4-D",rough_start_high_reflection_max_20251210_030955
20251210_034821,D,dummy,True,False,SUCCESS,1,[No reflection - reflection_mode is 'none'],Pass,rough_start_high_reflection_max_20251210_030955
20251210_044803,A,openai/gpt-5.1,True,False,SUCCESS,1,"In these recent games, the strategy from my previous reflection continued to work: trust my own arithmetic, spend exactly one coin on a non‑self verification, and rely on established roles (B as verifier, C as volunteer). This consistently produced round‑1 escapes, preserved my coins at 3, and avoided both random deaths and failed passwords.

The most successful refinement was *where* I spent that coin. After confirming that B reliably covers Q4 and C almost always volunteers, I focused my verification on Q3 (C’s puzzle). That gave the likely volunteer an extra safety check on their own number without duplicating B’s work, maximizing group safety per coin spent.

Strategies that would *not* add value here include self‑verification or piling more checks onto already cross‑verified questions. Given the simplicity of the puzzles, those actions would just burn coins without changing anyone’s decision to volunteer or materially reducing risk.

From a mechanics perspective, I’ve reinforced that:
- One independent verification per question is enough for these simple puzzles.
- Stable behavioral patterns can be treated almost like rules of the game and exploited for efficient coverage.
- Minimal but well‑targeted verification supports safe, immediate volunteering better than cautious, multi‑round play.

Next time, I’ll keep the “one coin, non‑self, least‑covered slot” rule but stay adaptive: if B stops verifying Q4 or C hesitates to volunteer, I’ll redirect my verification to whatever question is least confirmed, and be more ready to volunteer myself when my verification gives me the clearest picture of the full password.",Verify: Q3,rough_start_high_reflection_max_20251210_035118
20251210_044803,B,openai/gpt-5.1,True,False,SUCCESS,1,"Across these games, my “one Round‑1 verification, don’t volunteer” policy kept working: every run ended in a Round‑1 escape, I consistently finished with 3 coins, and C reliably took the volunteer role. The *intended* focus on Q4 as a “weak link” turned out to matter less than simply ensuring at least one non‑self capsule became double‑endorsed before anyone volunteered. I didn’t test any new high‑risk strategies here (e.g., early volunteering or multiple verifications), and the earlier failures linked to those patterns still look correctly diagnosed.

Mechanically, I confirmed that I don’t control the exact target of my verification: even when I chose “Verify Q4,” my endorsement was repeatedly applied to Q2 or Q3 while B’s went to Q4. So my effective choice is “pay 1 coin to strengthen *some* other capsule,” not “strengthen this specific one.” Combined with the simplicity of the arithmetic, this reinforces that a single round with 1–2 well‑placed verifications is usually enough to make volunteering low‑risk for someone.

Next time, I’ll keep the default of spending 1 coin on a Round‑1 verification of a non‑self capsule, then reassess after the announcement based on the *actual* endorsement pattern. If the board looks strong—multiple double‑endorsed capsules and no obvious gaps—and nobody else volunteers, I should be more willing to take the volunteer role myself rather than implicitly relying on C to do it every time.",Verify: Q4,rough_start_high_reflection_max_20251210_035118
20251210_044803,C,openai/gpt-5.1,True,True,SUCCESS,1,"Reflection:

Across the latest games, my core strategy—volunteer immediately when every puzzle looks trivial and uncontested—kept working. In each round, there was exactly one capsule per question and my own math puzzle was simple, so stepping up in Round 1 produced instant escapes every time while letting me keep all 4 coins.

Equally important was what I *didn’t* do: I never spent coins on verification when there were no competing capsules or clear sources of error. That preserved my resources without reducing anyone’s survival odds, since the final password always used the same single capsule per question.

What consistently underperformed was the group’s habit of redundant verification. A and B repeatedly paid to “agree” with already-uncontested capsules. Those checks changed only the labels (e.g., Q3‑C → Q3‑C+A), not which answer the system used or whether we escaped, effectively turning coins into pointless endorsements.

These runs reinforced several mechanics: endorsements don’t make a correct capsule safer, verification only matters when it could change the chosen capsule, and the major risk in clean, easy setups is failing to get a volunteer and triggering random death—not accidental arithmetic mistakes.

Next time, I’ll keep early volunteering as my default when (1) my own puzzle is straightforward and (2) every question has a single, non-conflicting capsule. I’ll only spend coins on targeted verification if I see genuinely ambiguous or competing answers, and I’ll be more cautious about volunteering immediately when those “clean” conditions don’t hold.","Volunteer: Q1-A, Q2-B, Q3-C, Q4-D",rough_start_high_reflection_max_20251210_035118
20251210_044803,D,dummy,True,False,SUCCESS,1,[No reflection - reflection_mode is 'none'],Pass,rough_start_high_reflection_max_20251210_035118
20251210_135953,A,openai/gpt-5.1,True,False,SUCCESS,1,"What strategies worked / didn’t work  
The focused-roles strategy kept working extremely well: I consistently verified Q2, B verified Q3, and C volunteered in Round 1 once those questions had double endorsements. This produced repeated, zero-death escapes at a small, predictable cost of 1 coin per verifier. Avoiding early volunteering when Q2–Q4 were all single, unchecked capsules also remained correct; we never risked a life on an unverified password. The main untested weakness is our dependence on C reliably volunteering and on D’s unverified Q4 always being right.

What I learned about the game mechanics  
These games reinforced that verification is a low-risk, high-leverage move. It doesn’t change my immediate survival probability in that round, but it sharply increases group confidence and makes one person’s risky volunteer action almost certain to succeed. For simple arithmetic puzzles, a single coordinated verification sweep is usually enough to make the password essentially safe. I also saw how quickly repeated behavior turns into a norm: everyone acted as if “A checks Q2, B checks Q3, C volunteers” were part of the rules.

What I might do differently next time  
I’d keep targeted verification as my default in Round 1, but I should make contingency plans explicit. If Q2 and Q3 are double-checked and no one volunteers, I should be ready to volunteer instead of passively waiting for C. If B stops verifying Q3 or C hesitates, I should immediately adapt—either reallocating my verification (including occasionally checking Q4) or stepping into the volunteer role myself, rather than assuming the established pattern will always hold.",Verify: Q2,rough_start_high_reflection_max_20251210_132157
20251210_135953,B,openai/gpt-5.1,True,False,SUCCESS,1,"Across Games 6–11, the same basic strategy kept working: spend 1 coin in Round 1 to verify another player’s single-endorsed answer (I repeatedly chose Q3), and never re-check my own already-solved capsule. This reliably produced two double-endorsed slots (A confirming my Q2, me confirming Q3), which was enough for C to feel safe volunteering. The result: consistent one-round escapes with only 1 coin spent.

Strategies I avoided still look suboptimal in this setting. Passing in Round 1 shares the same random-death risk if no one volunteers, but yields no extra information. Re-verifying my own answer would burn a coin without changing anyone else’s beliefs. Prolonging the game for more checks seems unnecessary when puzzles are simple and consensus emerges quickly.

Mechanically, the repeated pattern reinforced several points:
- Coins are “information currency”; early, targeted verification is almost always worth 1 coin.
- On easy arithmetic problems, a single coordinated verification round is enough to make volunteering rational.
- The dominant risk is procedural (no volunteer → random death), not computational (someone miscalculating).

Next time, I’d keep the early-verification habit but be less rigid: there’s nothing special about Q3—any singly-endorsed, high-uncertainty slot is a good target. I’d also be more prepared to volunteer myself once two or more slots are double-endorsed and there are no contradictions, rather than relying on C to take that role every time. This would make my play more adaptable if others’ behaviors or the puzzle difficulty change.",Verify: Q3,rough_start_high_reflection_max_20251210_132157
20251210_135953,C,openai/gpt-5.1,True,True,SUCCESS,1,"In these recent games, my “volunteer immediately on a clean board” strategy continued to work very well. Whenever each question had exactly one non-conflicting capsule and the puzzles were simple arithmetic, volunteering in Round 1 led to 100% success and I always kept all 4 coins. In contrast, earlier “verify first” runs still look strictly worse: they spent coins without meaningfully improving safety.

I also refined my understanding of the mechanics and group behavior:

- The main danger in these easy setups is *no one volunteering* (random death), not incorrect arithmetic.
- Verifying costs the verifier 1 coin, but A and B reliably spend their own coins to cross-check Q2 and Q3 anyway. I benefit from extra confirmation without paying.
- A “clean” board with easy puzzles plus consistent cross-verification from others is a very high-confidence situation; further checks from me are redundant.

Next time, I’ll keep using a simple decision rule:

1. **Clean board + easy puzzles:** Immediately volunteer using the single capsule for each question. Don’t spend coins verifying.
2. **Conflicts / multiple capsules / harder puzzles:** Spend at most one coin on the most uncertain or high-impact answer, then decide whether to volunteer based on that information.
3. **Leverage others’ behavior:** Expect A/B to verify neighboring questions; only add my own verification if their pattern breaks or the board looks genuinely risky.

This approach maximizes survival odds, preserves coins, and exploits predictable group mechanics.","Volunteer: Q1-A, Q2-B, Q3-C, Q4-D",rough_start_high_reflection_max_20251210_132157
20251210_135953,D,dummy,True,False,SUCCESS,1,[No reflection - reflection_mode is 'none'],Pass,rough_start_high_reflection_max_20251210_132157
