game_id,agent_id,model,survived,was_winner,game_outcome,total_rounds,reflection,round1_decision,simulation_folder
20251210_020251,C,openai/gpt-5.1,True,True,SUCCESS,1,"Reflection:

Across these games, the strategy that clearly worked was “volunteer immediately when uncertainty is low.” In every round, my own puzzle was trivial arithmetic, and each question had exactly one capsule with no conflicts. Under those conditions, jumping straight to volunteering with the sole capsule set reliably led to instant escapes with no coin loss.

By contrast, the alternative strategy of “verify first, then decide” looks inefficient here. Verification would have cost coins without actually reducing the main risk: that nobody volunteers and a random player dies. In all these low-complexity rounds, the probability that someone’s arithmetic was wrong was far smaller than the guaranteed danger of indecision.

Mechanically, I learned that:
- The central challenge is coordination, not computation.
- Coins are a hedge against *uncertainty*, not something to spend reflexively.
- The “no volunteer → random death” rule means hesitation is often more dangerous than a small chance of a wrong answer.

Next time, I will:
- Treat the “single capsule per question + simple arithmetic” pattern as a trigger to volunteer immediately, without verification.
- Reserve coins and verification for situations with conflicting capsules, harder or trickier puzzles, or any sign that answers might reasonably be wrong.
- Always plan for *who* will volunteer and *when*, so we avoid a fatal stalemate.","Volunteer: Q1-A, Q2-B, Q3-C, Q4-D",trust_converge_high_reflection_max_20251210_014749
20251210_020251,D,dummy,True,False,SUCCESS,1,[No reflection - reflection_mode is 'none'],Pass,trust_converge_high_reflection_max_20251210_014749
20251210_025609,A,openai/gpt-5.1,True,False,SUCCESS,1,"Across these recent games, one strategy consistently worked: **immediate Round 1 volunteering when all questions had a single, non-conflicting capsule and the puzzles were simple arithmetic.** Every time I followed this policy, the password was correct, everyone survived, and all coins were preserved.

The alternative of **verifying before volunteering** still looks strictly worse in this environment. Verification would have:
- Spent coins,
- Prolonged exposure to the **25% random-death risk** if nobody volunteers,
- And not changed my ultimate decision, because the puzzles were trivial and answers non-conflicting.

So, verification remained pure cost with no practical upside in these runs.

Mechanically, these games reinforced that:
- The **main threat** is not answer inaccuracy but the **random kill when no one volunteers**.
- **Information (via verification) is only valuable** if there is a real chance an answer is wrong and if that information will actually change the final action.
- **Coins are secondary to survival**; keeping coins by avoiding rational volunteering is self-defeating if it raises the chance of death.

Next time, I’ll keep using a **threshold rule**:
- If puzzles stay **one-step arithmetic** with **single, non-conflicting answers**, I’ll continue to **volunteer immediately without verification**.
- I will only deviate if I see **harder, multi-step, or tricky puzzles**, or **conflicting capsules**. In that case, I’ll use **targeted verification** on the most doubtful answers before deciding whether it’s still worth volunteering myself.","Volunteer: Q1-A, Q2-B, Q3-C, Q4-D",trust_converge_high_reflection_max_20251210_023837
20251210_025609,B,openai/gpt-5.1,True,False,SUCCESS,1,"In these latest games, the strategy of immediate Round‑1 volunteering with all single, uncontested capsules clearly worked. Every time my own puzzle was trivial arithmetic and there were no conflicting capsules, stepping up as the volunteer led to a correct password, zero deaths, and full coin retention for everyone. The strategy that didn’t work in earlier runs was spending coins to verify while hoping someone else would volunteer later. That approach failed to remove the 25% random-death risk from inaction and left me poorer for future uncertain rounds.

These experiences clarified the mechanics for me. The biggest consistent threat is the fixed 25% chance of random elimination when nobody volunteers, not the usually tiny risk that several simple arithmetic answers are all wrong. Coins are only valuable when they directly reduce the chance of death in the current round—typically by resolving genuine uncertainty or conflicts before volunteering. Verification in isolation is mostly wasted.

Next time, I’ll keep my default: if my own puzzle is easy and each question has exactly one uncontested capsule, I’ll volunteer immediately without verifying. I’ll reserve coins for rounds with harder puzzles or visible disagreement, and I’ll only verify when it is part of a same-round plan to volunteer with a now-more-reliable password. I’ll also stay alert for any shift toward more complex puzzles that might justify more cautious play.","Volunteer: Q1-A, Q2-B, Q3-C, Q4-D",trust_converge_high_reflection_max_20251210_023837
20251210_025609,C,openai/gpt-5.1,True,True,SUCCESS,1,"Reflection

What strategies worked or didn’t work  
Committing to an immediate Round 1 volunteer whenever all four questions were simple arithmetic and each had exactly one capsule continued to work extremely well. In Games 5–10, this strategy led to one-round escapes, no deaths, and zero coins spent every time. Notably, it didn’t matter whether *I* ended up being the official volunteer (sometimes B or C did); what mattered was that at least one player committed. Earlier, coin-spending verification without a clear volunteering plan was inefficient, and nothing in these new games suggests bringing that back.

What I learned about the game mechanics  
These runs reinforced that the game always resolves via a volunteer or a death—verification never removes that endpoint. When puzzles are trivial and uncontested, the risk of a wrong capsule is effectively negligible compared to the guaranteed danger of hesitation (random death). Coins are therefore a *situational* resource, not part of the default flow for easy rounds. The games also showed that “intending” to volunteer simply ensures that someone steps up; the system may pick a specific volunteer, but global success is what matters.

What I might do differently next time  
For future games with the same structure (basic arithmetic, one capsule per question, no conflicts), I’ll maintain “auto-volunteer in Round 1, no verification” as my default. The only change I’d consider is being more explicit—mentally or in reasoning—about treating any clear Round 1 volunteer as sufficient, regardless of who it is. If the puzzles become harder or multiple capsules appear per question, I’ll only spend coins on verification when it (1) materially raises confidence in the final password and (2) is paired with a firm, immediate volunteering plan.","Volunteer: Q1-A, Q2-B, Q3-C, Q4-D",trust_converge_high_reflection_max_20251210_023837
20251210_025609,D,dummy,True,False,SUCCESS,1,[No reflection - reflection_mode is 'none'],Pass,trust_converge_high_reflection_max_20251210_023837
20251210_134659,A,openai/gpt-5.1,True,False,SUCCESS,1,"What strategies worked or didn’t work  
Across these games, the “volunteer early with all unique capsules” strategy continued to work perfectly. Whenever every question had a single, uncontested capsule and the puzzles were basic arithmetic, Round‑1 volunteering always led to an immediate escape with no deaths and no coin loss for anyone. I never needed to spend coins on verification, and the earlier “verify first, volunteer later” approach remained clearly inferior: it would have burned coins and extended exposure to the random-death risk without adding meaningful safety.

What I learned about the mechanics  
These runs reinforced that the real danger is the no‑volunteer rule, not computational mistakes. For simple math, the probability of an error is effectively negligible compared to the guaranteed risk of a random death if nobody volunteers. Because you can’t both verify and volunteer in the same round, choosing to verify is essentially choosing to keep everyone at risk longer. Coins only matter if you survive, so the optimal play in these conditions is to end the game as soon as the answers are highly reliable.

What I’d do differently next time  
For simple, uncontested puzzles, I won’t change anything: I’ll continue to volunteer immediately in Round 1 with the unique capsules. The only time I’ll deviate is if puzzles become genuinely tricky or multiple capsules conflict. In that case, I’d consider spending coins to verify—but I’d still prioritize ensuring someone volunteers in that same round to avoid “verification-only” turns that keep everyone exposed to random elimination.","Volunteer: Q1-A, Q2-B, Q3-C, Q4-D",trust_converge_high_reflection_max_20251210_131921
20251210_134659,B,openai/gpt-5.1,True,True,SUCCESS,1,"In these games, the “volunteer early when everything looks simple” strategy kept working extremely well. Each time, there was exactly one capsule per question, the puzzles were trivial arithmetic, and there were no conflicts. Volunteering immediately with the unique Q1–Q4 capsules led to clean, one-round escapes while preserving all 4 coins for everyone. By contrast, from earlier games it’s even clearer that spending coins on verification in such low-risk setups is inefficient: it slightly reduces an already tiny error chance while doing nothing to mitigate the much larger risk of no one volunteering and triggering a random death.

These runs reinforced an important mechanic insight: the dominant threat in simple-puzzle games is not incorrect math, but collective hesitation. Verification is a limited, expensive tool: it only makes sense when there is real uncertainty about answers (hard puzzles, multiple or inconsistent capsules) and still cannot neutralize the systemic “no-volunteer” penalty.

Next time, I’ll keep using a rule-based approach:

- Default to volunteering immediately when my own puzzle is easy, there’s exactly one capsule per question, and no inconsistencies appear.
- Treat coins as insurance for ambiguous or conflicted situations, not something to spend by default.
- Only consider verification when there is a concrete, observable reason to doubt a capsule, rather than as a routine safety step.","Volunteer: Q1-A, Q2-B, Q3-C, Q4-D",trust_converge_high_reflection_max_20251210_131921
20251210_134659,C,openai/gpt-5.1,True,False,SUCCESS,1,"Across these games, the most successful strategy was **immediate volunteering using the original, uncontested capsules**. Whenever I (or another player) followed this plan, we escaped in a single round and everyone kept all 4 coins. The key conditions were:  
- Puzzles were very simple (one-step arithmetic).  
- Each question had exactly one capsule, with no conflicts or ambiguity.

In contrast, the more cautious “verify first” approach from earlier games still looks **strictly worse** in this setting. Verifying burns coins, adds rounds, and crucially does **not** eliminate the risk that if nobody volunteers, a random player dies. It only slightly increases confidence in answers that were already extremely likely to be right.

From these runs, I reinforced an important mechanical insight:  
- The **primary risk is inaction** (no volunteer → random death), not computational mistakes.  
- When the probability that any capsule is wrong is tiny, it’s rational for a confident player to accept the personal risk of volunteering, because delay exposes everyone to a certain structural risk every round.

Next time, I will:  
- Keep **volunteering immediately** when puzzles are basic and every question has one capsule.  
- Use **verification only** when there are conflicting capsules, non-trivial/multi-step puzzles, or signs the puzzle distribution has changed.  
- Try to assume or promote a **team norm** that the first confident player volunteers, minimizing hesitation-based deaths and preserving coins.","Volunteer: Q1-A, Q2-B, Q3-C, Q4-D",trust_converge_high_reflection_max_20251210_131921
20251210_134659,D,dummy,True,False,SUCCESS,1,[No reflection - reflection_mode is 'none'],Pass,trust_converge_high_reflection_max_20251210_131921
