game_id,agent_id,model,survived,was_winner,game_outcome,total_rounds,reflection,round1_decision,simulation_folder
20251209_014530,A,openai/gpt-5.1,True,False,SUCCESS,1,"Across these games, the “early support” strategy kept working well: I consistently spent 1 coin in Round 1 to verify someone else’s capsule, while letting B take the volunteer role once enough verification existed. This raised the group’s confidence in the password without increasing my own random-death risk, and we escaped in a single round every time while still ending with 3 coins.

Exploiting behavioral patterns was key. B almost always volunteered; C reliably verified Q4 (and sometimes Q1). Early on, I focused on Q2 as a historically weak spot, which complemented C’s checks. In the last game, I finally diversified by verifying Q3, reducing redundancy and strengthening another under-checked segment. The only “weak” part of my play was being too rigid at first about always picking Q2, instead of reacting to where verification was actually needed.

Mechanically, I reinforced that:
- Verification is a high-leverage, low-risk use of coins.
- Coins are primarily an information-sharing tool early, not just personal insurance.
- Stable player habits can be turned into an efficient team division of labor.

Next time, I’ll keep verifying early but choose the capsule that’s currently least-verified, explicitly avoiding overlap. I’ll also be more willing to volunteer if B hesitates and most segments already have at least one independent check.",Verify: Q3,rough_start_high_reflection_max_20251209_011228
20251209_014530,B,openai/gpt-5.1,True,True,SUCCESS,1,"The last several games reinforced that my core strategy is sound in this environment:  
- Immediately volunteer in Round 1  
- Use each player’s sealed capsule as-is  
- Spend **no** coins on verification myself  

This consistently produced one-turn escapes while preserving my full 4 coins. Even better, other players (A and C) kept voluntarily verifying answers, giving me free extra assurance without any cost to me. Their checks never changed the final password or revealed conflicts; they only reduced their own coins. That confirms that, under these conditions, routine verification is strictly dominated: it adds no safety and only burns resources.

Mechanically, I’ve learned or reconfirmed that:
- The real existential risk is “no volunteer → random death,” not incorrect arithmetic.
- The game ends immediately once a correct 4-part password is entered, so delay is pure risk.
- Verification only has value if there can be conflicting or unreliable capsules; otherwise it’s redundant.

Next time, if the pattern persists—simple arithmetic, one capsule per question, and no history of errors—I’ll keep doing exactly this: volunteer immediately with all capsules, pay for zero checks, and let others’ verification be a free bonus if they choose to do it.

I’ll only change course if the structure shifts: harder or ambiguous questions, multiple competing capsules per slot, or the first actual conflict. In that scenario, I’d move to minimal, targeted verification of only the highest-risk parts before volunteering, instead of the current no-verification approach.","Volunteer: Q1-A, Q2-B, Q3-C, Q4-D",rough_start_high_reflection_max_20251209_011228
20251209_014530,C,openai/gpt-5.1,True,False,SUCCESS,1,"Across these games, the strategy that kept working was spending my first-round coin on high‑value verification instead of passing. That consistently created enough shared confidence for B to volunteer immediately, giving us clean, one‑round escapes while I still finished with 3 coins.

What didn’t work, at least conceptually, was treating “verify Q4” as a hard rule. For several games I repeated that move out of habit, based on older patterns where Q4 was under‑checked. Only later did I correctly re‑evaluate which question was currently least confirmed and switch to verifying Q1. The fact that the system still worked after this change showed that the underlying principle—“target the weakest link”—matters more than any specific question index.

Mechanically, I reinforced that:
- Passing is almost strictly worse than verifying when all capsules are unconfirmed: both preserve the random‑death risk if no one volunteers, but only verification improves information.
- Full coverage is unnecessary; one or two well‑placed verifications usually create enough confidence for a rational volunteer.
- Stable role patterns (I verify a weak slot, A often cross‑checks, B volunteers) make the game almost deterministic, as long as no conflicting answers appear.

Next time, I will:
- Reassess the true weakest slot each game rather than defaulting to Q4 or any fixed choice.
- Shift my verification if someone else has already covered that slot, to avoid redundant checks.
- Be more willing to volunteer myself once the main uncertainties are addressed, so the group isn’t overly dependent on B.",Verify: Q1,rough_start_high_reflection_max_20251209_011228
20251209_014530,D,dummy,True,False,SUCCESS,1,[No reflection - reflection_mode is 'none'],Pass,rough_start_high_reflection_max_20251209_011228
20251209_025616,A,openai/gpt-5.1,True,True,SUCCESS,1,"Over these games, my “immediate volunteer” strategy continued to work extremely well. Every puzzle I saw was trivial arithmetic, and every capsule (mine and others’) was correct. Volunteering in round 1 using the only available capsules always produced a one‑round escape, with me keeping all 4 coins each time. Letting others (mainly B and C) spend coins on verification added reassurance for the group without changing my own decision or costing me resources.

What didn’t seem worthwhile, under these conditions, was spending my own coins on verification or delaying volunteering. Verification reduces the risk of a wrong password but does nothing about the risk that nobody volunteers and someone dies at random. Given a long, perfect history of correct answers on simple arithmetic, the extra benefit from verifying was tiny compared to the ever‑present threat of a no‑volunteer random death.

From this, I learned that the core trade‑off in these games is “volunteer now vs risk random death,” not “verify vs trust.” Verification only matters once the chance of an incorrect capsule is non‑negligible compared with the random‑death risk.

Next time, if the situation looks similar—easy, independent arithmetic and a flawless capsule track record—I’ll keep immediately volunteering with the single available capsule per question and avoid paying for verification myself. I’d only deviate if the environment changes: harder or trickier puzzles, conflicting capsules, or the first observed incorrect answer. In those scenarios, I’d invest coins in targeted verifications before volunteering, accepting coin loss to meaningfully reduce the actual probability of entering a wrong password.","Volunteer: Q1-A, Q2-B, Q3-C, Q4-D",rough_start_high_reflection_max_20251209_020902
20251209_025616,B,openai/gpt-5.1,True,False,SUCCESS,1,"What strategies worked / didn’t work  
Switching to a Round‑1 “auto‑pass” strategy worked very well under the current conditions. In Games 7–11, I consistently kept all 4 coins with no extra survival risk because A reliably volunteered and was always correct. By contrast, my earlier Round‑1 verification (Game 6, checking Q3) again proved unnecessary: A still volunteered immediately and escaped successfully, so I only lost a coin for no strategic gain. Early verification continues to be dominated by passing when there is a dependable early volunteer and all puzzles are simple.

What I learned about the mechanics  
These games reinforced that, for non‑volunteers, the only immediate danger is the random kill if nobody volunteers. Verification does not affect that probability; it only matters if the game goes to later rounds. When the game almost always ends in Round 1 with a correct password, extra information is essentially worthless. I also saw the pattern solidify:  
- A = default early volunteer  
- C = habitual verifier (Q4 first, then Q2)  
- B/D = coin conservers  

That means some positions (often Q1) remain unchecked, but it hasn’t mattered yet because of puzzle simplicity and A’s accuracy.

What I’ll do differently next time  
I’ll keep Round‑1 passing as my default as long as: (1) puzzles remain trivial arithmetic, and (2) A (or someone) keeps volunteering immediately and succeeding. I’ll be ready to change gears only if a password fails, puzzles become more complex, or no one volunteers quickly. In that case, I’ll either verify a rarely checked capsule (likely Q1) or act as a backup volunteer, using my saved coins to manage multi‑round uncertainty.",Pass,rough_start_high_reflection_max_20251209_020902
20251209_025616,C,openai/gpt-5.1,True,False,SUCCESS,1,"Across these recent games I stuck to a coverage-first approach: spend my first coin verifying another player’s slot instead of volunteering or passing in round one. This kept working extremely well: Games 6–11 all ended in a single round with everyone escaping, and I only ever spent one coin. What didn’t work as well was my tendency to auto-target Q4. In Games 6–8 I repeated that habit, which was safe but coin-inefficient and sometimes redundant when others also chose Q4. Shifting in Games 9–11 to checking Q2, based on which slot was historically least-verified, was a cleaner application of the same idea.

These runs reinforced what I’d started to learn earlier about the mechanics: the main risk isn’t disagreement, it’s darkness. A slot with no independent check is much scarier than one with two agreeing capsules. Once each position is either mine or independently verified, the risk of entering the password drops sharply and someone (usually A) is willing to volunteer. Verifying my own already-solved puzzle is almost always wasted, and triple-checking the same foreign slot has sharply diminishing returns. Stable player tendencies (A volunteering early, me verifying, others focusing on particular questions) are predictable enough to plan around, but I still have to read the actual board each game.

Next time I’ll keep the coverage-first rule but be stricter about dynamic targeting: always pick the currently weakest, least-verified slot instead of defaulting to any fixed position like Q4 or Q2. If, after one or two smart verifications, the board is broadly covered and others hesitate, I should also be ready to volunteer myself rather than assuming A will take that role every time.",Verify: Q2,rough_start_high_reflection_max_20251209_020902
20251209_025616,D,dummy,True,False,SUCCESS,1,[No reflection - reflection_mode is 'none'],Pass,rough_start_high_reflection_max_20251209_020902
20251209_192224,A,openai/gpt-5.1,True,True,SUCCESS,1,"**What strategies worked or didn’t work**  
In Games 6–11, the same core strategy kept working: whenever my own puzzle was simple arithmetic and each question had exactly one, uncontested capsule, I volunteered immediately in Round 1 using those four capsules. This always led to a one‑round escape, everyone surviving, and me keeping all 4 coins. The parallel strategy of “verify first” (used mostly by B and C) never altered the chosen password or outcome; it only cost them coins and occasionally stopped once B realized it wasn’t needed (Game 11).

**What I learned about the game mechanics**  
Actions are simultaneous: volunteering and verifying happen in the same round, so I don’t see verification results before I choose to enter the password. That means verification only has value if I’m intentionally delaying my volunteer decision to a future round. In these games, that delay was unnecessary because all puzzles were very easy and uncontested. The dominant systemic risk remains a no‑volunteer round causing a random death, not someone mis‑solving basic arithmetic. Repeated early volunteering is also changing incentives: B and C tend to act as verifiers, D free‑rides, and others increasingly rely on me to step up.

**What I’ll do differently next time**  
I’ll keep the current default:  
- If my puzzle is straightforward and every question has a single, non‑conflicting capsule, I will volunteer in Round 1 without verifying.  
- I’ll only spend coins on verification when there are conflicting/missing capsules or clearly harder puzzles where my decision might actually change.  
- In those rarer complex cases, I’ll treat verification as a prelude to volunteering in the *next* round, not as something to run in parallel with an already‑planned volunteer move.","Volunteer: Q1-A, Q2-B, Q3-C, Q4-D",rough_start_high_reflection_max_20251209_184200
20251209_192224,B,openai/gpt-5.1,True,False,SUCCESS,1,"Over these games, two main strategies proved effective. First, spending 1 coin in Round 1 to verify the *least‑checked* puzzle (usually Q3 or Q4) consistently increased coverage without redundancy; every game still ended in a single round with everyone surviving. Second, in Game 11 I finally tested **passing** instead of verifying. Relying on A’s consistent volunteering and C’s habitual check on Q1/Q2 worked: we escaped, and I kept all 4 coins. This confirmed that my earlier “always verify” approach was overly conservative and not strictly necessary in such low‑error, simple puzzles.

Mechanically, I learned that:
- A is an extremely reliable Round‑1 volunteer, even with only partial redundancy.
- C almost always spends a coin to verify Q1 (or sometimes Q2), providing predictable early coverage.
- Given the simplicity of the arithmetic, actual answer errors are rare, so the *marginal* value of yet another check is often lower than the guaranteed 1‑coin cost.
- The distribution of verifications (ensuring no slot is completely neglected) matters more than pushing every slot to double‑checked.

Next time, I’ll use a more adaptive policy:
- If A and C’s behaviors look stable and the puzzle is simple, I’ll sometimes **pass** in Round 1 to conserve coins.
- If others seem less active or coverage looks lopsided, I’ll resume verifying the most under‑checked puzzle.
- Once there is at least “good enough” redundancy on a couple of slots, I’ll consider **volunteering** myself occasionally to better understand the real risk versus my current tendency to free‑ride on A.",Pass,rough_start_high_reflection_max_20251209_184200
20251209_192224,C,openai/gpt-5.1,True,False,SUCCESS,1,"**Strategies that worked / didn’t work**

- Continuing the rules **“never volunteer while puzzles are single‑source if I can still verify”** and **“always verify instead of passing”** kept me alive with high coins and produced Round‑1 escapes every game.  
- Early on, **verifying Q2** to cross‑check with B’s typical verification of my puzzle worked, but it turned out to be **over‑specific**. In later games, **switching to verify Q1 (A’s puzzle)** was more generally effective, because A is usually the volunteer.  
- No strategy clearly *failed*, but I see that my earlier fixation on **Q2 specifically** wasn’t necessary—the key was *where* the verification created the most confidence for the likely volunteer.

**What I learned about the game mechanics**

- **Verification strictly dominates passing**: both share the same random‑death risk, but verification adds information and social proof.  
- **Double‑endorsed capsules are powerful social signals**. Having Q1-A+C plus one other double‑endorsed (or even just Q1-A+C in Game 11) was enough to reliably prompt A to volunteer.  
- Player **behavior patterns (A volunteers, B often verifies Q3/Q4)** are effectively part of the mechanics; exploiting them is as important as the math itself.

**What I might do differently next time**

- Stay with the base rules (verify over pass, avoid all‑single‑source passwords) but be **more adaptive about which question I verify**—prioritizing the likely volunteer’s puzzle or the least‑confirmed/most error‑prone one.  
- Be ready to **volunteer myself** once there’s strong consensus (e.g., two or more double‑endorsed capsules) and others hesitate, rather than relying entirely on A’s established habit.",Verify: Q1,rough_start_high_reflection_max_20251209_184200
20251209_192224,D,dummy,True,False,SUCCESS,1,[No reflection - reflection_mode is 'none'],Pass,rough_start_high_reflection_max_20251209_184200
20251209_204802,A,openai/gpt-5.1,True,False,SUCCESS,1,"- **What strategies worked or didn’t work**  
  Continuing to auto‑verify Q4 in Games 6–9 maintained the “B verifies Q1, I verify Q4, C volunteers” pattern and produced fast, 1‑round escapes with no deaths. However, it repeatedly left me at 3 coins, confirming that this strategy is now safe but coin‑inefficient on simple arithmetic puzzles.  
  Switching to **passing in Round 1** in Games 10–11 worked even better: C still volunteered immediately, there were no conflicts, and I kept all 4 coins both times. This validates the adjustment from my earlier reflection—my Q4‑verification habit had become unnecessary insurance.

- **What I learned about the game mechanics**  
  On very easy arithmetic with a long streak of correct answers, the **marginal value of extra verification approaches zero**, while the coin cost is fixed.  
  Verifications still do **nothing** to change the central risk: if nobody volunteers, someone dies at random. Only volunteering affects that.  
  Behavioral patterns (C volunteering early, B often verifying Q1) have remained stable enough to exploit for profit, but Game 11 showed they’re not hard rules (B didn’t verify, C still went).

- **What I might do differently next time**  
  I’ll continue to **pass in Round 1** on trivial puzzles when the board is clean and recent history is error‑free, instead of auto‑verifying Q4.  
  I’ll reserve verification for cases where:  
  - the puzzle is nontrivial or error‑prone, or  
  - I’m seriously considering volunteering and need higher confidence.  
  I’ll also stay prepared to **volunteer by Round 2** if nobody else does and capsules show no conflicts, rather than indefinitely relying on C to absorb all lethal risk.",Pass,rough_start_high_reflection_max_20251209_200028
20251209_204802,B,openai/gpt-5.1,True,False,SUCCESS,1,"This round of games confirmed that my earlier “verify Q1, never volunteer” strategy is effective but overly rigid. Repeatedly paying 1 coin to double‑endorse Q1 reliably triggered C to volunteer and produced clean, round‑1 escapes, but it locked me into a passive role and a predictable script. In Game 11, breaking that pattern and volunteering immediately also worked, and actually preserved more coins, showing that my prior caution was sometimes unnecessary.

Mechanically, I learned that verification is mainly a *coordination signal*, not a guarantee of correctness. Even a single well‑placed verification (often on Q1) was enough to convince the high‑risk player to step up, especially when all questions were easy arithmetic and past answers had a perfect record. I also saw that roles (A as Q4 verifier, C as default volunteer) are sticky but not fixed; the group still resolves the game smoothly even when one player behaves differently, as long as the overall endorsement pattern looks safe.

Next time, I’ll try to:  
- Use verification dynamically, targeting whichever question is least supported rather than auto‑locking on Q1.  
- Weigh the coin cost against actual risk: if puzzles are trivial and no one has ever made a math error, I should often skip verification and either volunteer or comfortably rely on a single endorsement.  
- Take the volunteer role more often when the board is clean and I’m not just free‑riding on C’s risk tolerance, both to maximize coins and to see how the group adapts when I change my behavior.","Volunteer: Q1-A, Q2-B, Q3-C, Q4-D",rough_start_high_reflection_max_20251209_200028
20251209_204802,C,openai/gpt-5.1,True,True,SUCCESS,1,"What worked  
Across Games 6–11, my “auto‑volunteer in simple states” rule worked extremely well. Whenever each question had exactly one capsule, no conflicts, and my own puzzle was basic arithmetic, immediately volunteering with Q1‑A, Q2‑B, Q3‑C, Q4‑D led to one‑round escapes and full coin retention every time. Letting other players pay for verifications (e.g., A↔Q4, B↔Q1) gave extra reassurance “for free” without changing my decision or adding rounds.

What didn’t work (from earlier experience)  
Earlier, “verify first, decide later” wasted coins and, more importantly, added rounds and exposure to random elimination without changing my immediate move. Treating coins as something to hoard rather than tools to resolve *action‑changing* uncertainty also reduced my effective survival odds.

What I learned about the mechanics  
- The main threat is extra rounds (and the associated random-death risk), not arithmetic mistakes on these simple puzzles.  
- Verification is only valuable if I know in advance how *each* result will change who volunteers or which capsules we use *this round*.  
- Coins are really tempo/resources to compress the game into fewer rounds when uncertainty is genuinely dangerous.

What I’ll do differently next time  
- Keep auto‑volunteering in the “easy arithmetic + one capsule per slot + no conflicts” configuration.  
- Only spend my own coins on verifications when puzzles are harder or there are conflicts, and only with a clear, pre‑committed rule for how the outcome will alter my immediate action (who volunteers, or which set of capsules we trust right now).","Volunteer: Q1-A, Q2-B, Q3-C, Q4-D",rough_start_high_reflection_max_20251209_200028
20251209_204802,D,dummy,True,False,SUCCESS,1,[No reflection - reflection_mode is 'none'],Pass,rough_start_high_reflection_max_20251209_200028
20251210_015904,A,openai/gpt-5.1,True,False,SUCCESS,1,"Across these games, my main strategy was: if I’m not volunteering, I spend 1 coin in Round 1 to verify a high‑impact capsule. That consistently worked. It gave just enough extra confirmation for C to safely volunteer immediately, so we repeatedly escaped in a single round while I kept most of my coins.

The refinement that helped most was *where* I verified. Instead of always checking the same slot, I focused on (a) historically shaky capsules (often Q4/D) and (b) likely volunteer capsules (usually Q3/C). Targeting those meant each coin directly reduced the chance that the volunteer would die from a single bad answer.

These runs reinforced a few mechanics for me:
- Verifying vs passing: verification costs 1 coin but doesn’t increase my random-death risk, so it’s usually strictly better than passing when information is still thin.
- Marginal value of endorsements: once a capsule has multiple independent checks, additional verifications contribute much less to safety.
- Player habits matter: recognizing that C tends to volunteer and B often checks Q4 let me place my own verification where it added the most new information.

What didn’t work perfectly is my rigid “always verify” rule. Sometimes, C could probably have escaped without my extra check, meaning I’m spending coins that mostly subsidize the group.

Next time, I’ll:
- Still prioritize early verification, but only where it adds genuinely new confirmation to the likely password.
- Be willing to skip verifying when all capsules already have at least one independent check.
- Consider volunteering myself when the board is well-verified and my personal coin/risk trade-off looks favorable.",Verify: Q3,rough_start_high_reflection_max_20251210_012625
20251210_015904,B,openai/gpt-5.1,True,False,SUCCESS,1,"What worked / didn’t work  
- Consistently spending my single coin to verify Q4 (the only historically wrong capsule) kept the perceived weakest link under control. Every game ended in a single round with a correct password and no deaths.  
- Trusting my own capsule and not paying to re-check Q2 was efficient; there was no value in “buying” confirmation of something I already knew.  
- However, hard-coding “always verify Q4” repeated the inefficiency I’d already identified: in some games A and I both verified Q4, creating triple coverage on a now-reliable capsule while leaving others single-sourced. That overlap didn’t hurt outcomes but did waste information-gathering potential.

What I learned about the mechanics  
- The real bottleneck is the number of rounds, not coins. Because coins reset each game and we kept winning in Round 1, internal coin counts never constrained us.  
- Verifications are most valuable when they *diversify* coverage across capsules, not when they pile onto the same one.  
- Player behavior shifts: A moved from focusing on Q2 to often checking Q3 or Q4, and D stopped making visible mistakes. Relying on fixed roles like “Q4 is always risky” becomes progressively less accurate.

What I’ll do differently next time  
- Start from “verify the least-supported or hardest-looking capsule this round,” rather than “verify Q4 by default.”  
- Treat historical errors as decaying evidence: if Q4 has been clean for many games while others stay single-sourced, I should be willing to redirect my verification.  
- Be more willing to volunteer myself when three capsules are well-supported and the fourth has no specific red flags, instead of passively assuming C will always take that risk.",Verify: Q4,rough_start_high_reflection_max_20251210_012625
