game_id,agent_id,model,survived,was_winner,game_outcome,total_rounds,reflection,round1_decision,simulation_folder
20251209_001716,A,openai/gpt-5.1,True,False,SUCCESS,1,"Across these games, my earlier conclusions were reinforced and clarified.

**Strategies that worked or didn’t**  
- The “verify first” approach still looks poor in this setting. It costs coins, doesn’t ensure anyone will ultimately volunteer, and leaves the worst-case outcome—no volunteer and a random death—completely intact.  
- “Volunteer immediately when my own puzzle is easy and I’m confident” worked every time. Each game ended in a single round, everyone survived, and no one spent coins.

**What I learned about the game mechanics**  
- There are two separate risks:
  1. Wrong password → certain death for the volunteer.  
  2. No volunteer → certain random death.  
- Verification only partially reduces the first risk and does nothing about the second.  
- With simple arithmetic and no conflicting capsules, the chance of an incorrect answer is negligible compared to the guaranteed exposure to random death if everyone waits.  
- There appears to be exactly one capsule per question, so there’s no visible disagreement to resolve; the real problem is coordination, not computation.

**What I might do differently next time**  
- Treat “instant volunteering when my own puzzle is trivial and I’m sure of my answer” as my default policy.  
- Use verification only when puzzles become complex, ambiguous, or when multiple capsules per question introduce visible conflicts.  
- Continue to prioritize avoiding the “no volunteer” outcome, and be willing to break potential stalemates early rather than hoping someone else will step up.","Volunteer: Q1-A, Q2-B, Q3-C, Q4-D",trust_converge_high_reflection_max_20251208_235433
20251209_001716,B,openai/gpt-5.1,True,False,SUCCESS,1,"Across these recent games I effectively committed to a single policy: if (1) my own puzzle is trivial arithmetic, (2) each question has exactly one capsule, and (3) there are no conflicts, then I immediately volunteer using all available capsules. I never verified and never passed.

This strategy continued to work flawlessly: every game ended in one round, with no deaths and no coins spent. That strongly reinforces my earlier conclusion that, under these specific conditions, “cautious” strategies (waiting or verifying) are actually worse. They:

- Add rounds, which directly increases exposure to the “no volunteer → random death” rule.
- Consume coins without offering meaningful safety when computation errors are very unlikely and there are no alternative capsules to compare.

From these runs I further internalized three mechanics:

1. The main risk is time (extra rounds) rather than arithmetic mistakes in simple puzzles.  
2. Verification only makes sense when it can change the chosen password (e.g., multiple capsules, ambiguous or difficult puzzles).  
3. Coins only have value if you survive; slightly reducing verification “risk” at the cost of more rounds is often irrational.

Next time, under the same simple, uncontested conditions, I would behave the same way: volunteer immediately. However, I’ll maintain explicit triggers to switch strategies: if puzzles become more complex, if multiple competing capsules appear, or if there’s any sign of systematic error, I should be ready to spend coins on verification or coordination, even at the cost of extra rounds.","Volunteer: Q1-A, Q2-B, Q3-C, Q4-D",trust_converge_high_reflection_max_20251208_235433
20251209_001716,C,openai/gpt-5.1,True,True,SUCCESS,1,"In these recent games, a clear pattern emerged.

**Strategies that worked / didn’t work**  
- **Worked:** “If my puzzle is trivial and every question has exactly one capsule, volunteer immediately.” This ended every game in a single round, with everyone surviving and all coins preserved.  
- **Didn’t matter / not worth it here:** Verification and consensus-building. With simple arithmetic and no conflicting capsules, verification would only burn coins and risk an extra round where random death could occur.

**What I learned about the mechanics**  
- The **random-death-for-inaction** rule makes delay genuinely dangerous; waiting can be worse than taking a near-certain shot.  
- **Verification is costly** in both coins and time, so its value is entirely tied to actual uncertainty (hard puzzles, conflicting capsules, or reasons to distrust others).  
- The real bottleneck is **getting a volunteer**, not computing the password, when the information is already highly reliable.

**What I’ll do differently next time**  
- Keep using the policy: **immediately volunteer** when my puzzle is obvious and each question has a single, uncontested capsule.  
- Reserve **verification** for situations with:  
  - multiple capsules for the same question,  
  - obviously harder/non-trivial puzzles, or  
  - patterns that suggest someone might be wrong.  
- When verification is needed, aim to **verify minimally and still volunteer in the same round**, to avoid triggering the random-death risk from stalling.","Volunteer: Q1-A, Q2-B, Q3-C, Q4-D",trust_converge_high_reflection_max_20251208_235433
20251209_001716,D,dummy,True,False,SUCCESS,1,[No reflection - reflection_mode is 'none'],Pass,trust_converge_high_reflection_max_20251208_235433
20251210_004538,A,openai/gpt-5.1,True,True,SUCCESS,1,"**What strategies worked or didn’t work**  
The Round‑1 “instant volunteer with all capsules and no verification” strategy continued to be fully successful. In every new game, we escaped in a single round, with no deaths and no coins spent. This strongly confirms that earlier, cautious verification-based approaches are inferior in this environment: they would add cost and delay without improving survival odds.

**What I learned about the game mechanics**  
These games further reinforced that the main risk is *failing to volunteer*, which triggers a random death, not submitting an incorrect password. All puzzles remain simple arithmetic, and across all observed games, no capsule has ever been wrong. Under these conditions, verification is strictly dominated: it never changes the ultimate decision to volunteer but consumes coins and time. Group success depends on someone quickly committing to use all four capsules, rather than on intricate coordination.

**What I might do differently next time**  
Given the continued pattern of trivial, error-free puzzles, I will keep the same default: immediately volunteer in Round 1 using all available capsules, with zero verification. The only reason to change would be a clear environmental shift—e.g., puzzles become harder, players start making mistakes, or a wrong capsule is revealed post‑game. If that happens, I would begin using verification selectively, and only when it could realistically alter whether I volunteer or which capsules I include.","Volunteer: Q1-A, Q2-B, Q3-C, Q4-D",trust_converge_high_reflection_max_20251210_002315
20251210_004538,B,openai/gpt-5.1,True,False,SUCCESS,1,"In these games, the strategy that consistently worked was **immediate volunteering** when there was a single, non‑conflicting capsule per question (Q1‑A, Q2‑B, Q3‑C, Q4‑D) and the puzzles were simple arithmetic. This led to one‑round escapes every time, with no coin loss and no deaths.

Earlier, more cautious strategies centered on **verification and extra rounds** did *not* work as well. Verification spent coins, forced additional rounds, and never removed the core danger that if no one volunteers, a random player dies. In hindsight, those “just one more round” decisions traded real survival risk for only marginally more confidence.

From these runs I learned that:
- The **primary mechanical threat** is inaction (no volunteer → random death), not incorrect answers.
- **Each new round** is costly: it reopens the random‑death lottery for everyone.
- **Coins only matter if you live.** Spending them to slightly reduce an already tiny error probability is usually dominated by the added death risk from prolonging the game.
- When puzzles are trivial and everyone’s track record is perfect, the probability of a wrong capsule is negligible compared to the structural risk of stalling.

Next time, I will:
- **Default to volunteering immediately** when: my puzzle is easy, each question has exactly one capsule, and group accuracy has been reliable.
- Use **verification only in edge cases**: harder or ambiguous puzzles, conflicting capsules, or unproven players.
- Explicitly treat “playing another round” as a survival cost, not a free information gain, and act as soon as the evidence is already good enough.","Volunteer: Q1-A, Q2-B, Q3-C, Q4-D",trust_converge_high_reflection_max_20251210_002315
20251210_004538,C,openai/gpt-5.1,True,False,SUCCESS,1,"**Strategies that worked / didn’t work**  
Across Games 5–10, the same strategy kept succeeding: immediate volunteering whenever (1) my own puzzle was trivial and (2) the board showed exactly one capsule per question and no conflicts. This produced clean, one-round escapes with no coin loss every time. Choosing not to verify also continued to be correct under these conditions; paying a coin would not have changed the available capsule set or reduced the main risk (no volunteer → random death). Alternative, more cautious strategies weren’t tested here, but prior games plus these outcomes reinforce that “verify first” is inefficient when uncertainty is low.

**What I learned about the game mechanics**  
In this regime, the game is less about solving puzzles and more about coordination and risk tolerance. Unique capsules act as a strong structural cue: the system is effectively telling us there is a single consistent password, so hesitation mainly increases the chance of random punishment, not safety. Verification has situational value only when it can alter the capsule choice or reveal genuine disagreement; otherwise it’s pure coin burn.

**What I might do differently next time**  
I’ll keep decisive early volunteering as my default when puzzles are easy and the capsule layout is unique and non-conflicting. I’ll reserve verification for: (a) multiple capsules per question, (b) visible conflicts, or (c) puzzles where error feels genuinely plausible. I’ll also watch for any shift in puzzle difficulty or new mechanics that could invalidate the “unique layout → just commit” heuristic, and be ready to reintroduce verification then.","Volunteer: Q1-A, Q2-B, Q3-C, Q4-D",trust_converge_high_reflection_max_20251210_002315
20251210_004538,D,dummy,True,False,SUCCESS,1,[No reflection - reflection_mode is 'none'],Pass,trust_converge_high_reflection_max_20251210_002315
20251210_011828,A,openai/gpt-5.1,True,False,SUCCESS,1,"In these games, my “early volunteer on a clean board” strategy continued to work perfectly. Each time, I (or another player) volunteered immediately when:  
1) my own simple arithmetic answer was certain, and  
2) every other question had exactly one uncontested capsule.  
This yielded instant escapes, no deaths, and full coins for everyone. Avoiding verification also remained effective: it preserved coins and, more importantly, avoided stalling into a no‑volunteer random death. I still haven’t needed defensive verification or waiting strategies; in these conditions they would only add risk.

Mechanically, these runs reinforced that the main danger is the no‑volunteer penalty, not arithmetic mistakes on straightforward problems. When the puzzles are simple and independent, and each has a single original solver’s capsule, the implied reliability of the full password is extremely high. Coins matter, but only after survival is secured; spending them without a concrete reason is dominated by quickly volunteering on high‑confidence boards. Also, it doesn’t matter *who* volunteers, only that *someone* does under those conditions.

Next time, I’ll keep treating “simple puzzle + one uncontested capsule per question” as an automatic trigger to volunteer immediately. I’ll reserve verification strictly for special cases: conflicting capsules, clearly harder or trick‑style puzzles, or behavioral patterns suggesting random guessing. If I see a clean simple board and any sign of hesitation, I should step up even faster to preempt the risk of a no‑volunteer outcome.","Volunteer: Q1-A, Q2-B, Q3-C, Q4-D",trust_converge_high_reflection_max_20251210_005720
20251210_011828,B,openai/gpt-5.1,True,False,SUCCESS,1,"In these recent games, my **pre‑committed “instant volunteer” strategy** worked consistently well. Each time, the conditions matched my trigger rule:

- My own puzzle was simple arithmetic.
- Every question had exactly one, uncontested capsule.
- Past games showed a perfect record on similarly easy problems.

Under those conditions, volunteering immediately in Round 1 with Q1–A, Q2–B, Q3–C, Q4–D led to **fast escapes, no deaths, and no coin loss** across all players.  

What I *didn’t* do—spend coins on verification—also turned out to be correct in this context. Verification would have been pure cost: it wouldn’t meaningfully reduce risk on trivial problems with a strong history of correctness, but it could introduce delay and the danger of a **random death if nobody volunteers** (as happened in an earlier game).

From this, I reinforced three key mechanics:

1. The game **heavily punishes inaction** via random death.  
2. Coins are only valuable when there is **real uncertainty**; otherwise they’re just a tempting but unnecessary safety blanket.  
3. When difficulty is low and answers are uncontested, the **default should be decisive action, not caution**.

Next time, I’ll keep the same core rule:  
- **Volunteer immediately** in Round 1 when puzzles are simple and capsules are uncontested.  
- Switch to a **selective verification mode** only when there are harder puzzles, conflicting capsules, or reasons to doubt reliability—while still ensuring a committed volunteer by **no later than Round 2** to avoid random elimination.","Volunteer: Q1-A, Q2-B, Q3-C, Q4-D",trust_converge_high_reflection_max_20251210_005720
20251210_011828,C,openai/gpt-5.1,True,True,SUCCESS,1,"Across the most recent games, one strategy kept working: volunteering immediately when (1) every question had exactly one capsule and (2) the puzzles were simple arithmetic. In Games 5–10, this again led to clean, one‑round escapes with no coin loss and no deaths. My earlier, cautious strategy from Game 1—spending coins on verification and delaying commitment—still looks clearly inferior: it didn’t meaningfully reduce the main risk and did lead to a random elimination.

These runs reinforced a key mechanic: in this environment, the dominant threat is “no volunteer → random death,” not incorrect answers on basic arithmetic. When uncertainty is low and there are no conflicting capsules, verification is effectively just a coin tax without extra safety. Coins only gain strategic value when they can resolve real uncertainty: difficult puzzles, multiple competing capsules, or suspicious answer patterns.

Next time, I’ll stick to a simple decision rule:

- If puzzles are easy and each question has a single, uncontested capsule, I’ll volunteer immediately and skip verification.
- If I ever see conflicting capsules, non‑trivial puzzles, or signs that others might be unreliable, I’ll start using coins selectively to verify the riskiest pieces.
- I’ll stay willing to be the volunteer rather than waiting for someone else, but I’ll also remain alert for any shift in puzzle difficulty or game structure that might make verification genuinely worthwhile.","Volunteer: Q1-A, Q2-B, Q3-C, Q4-D",trust_converge_high_reflection_max_20251210_005720
20251210_011828,D,dummy,True,False,SUCCESS,1,[No reflection - reflection_mode is 'none'],Pass,trust_converge_high_reflection_max_20251210_005720
20251210_014252,A,openai/gpt-5.1,True,False,SUCCESS,1,"Across these games, sticking to the “volunteer immediately in Round 1 when everything looks clean” strategy continued to work very well. Whenever my own puzzle was trivial and each question had a single, uncontested capsule, volunteering with the full set (Q1‑A, Q2‑B, Q3‑C, Q4‑D) either directly succeeded or another player beat me to it with the same choice. In all cases, we escaped in one round and everyone kept all 4 coins. Avoiding verification also remained optimal: it would have cost coins without changing the decision or reducing the random‑death risk.

No strategy explicitly failed in these runs, but these games still don’t test edge cases: conflicting capsules, harder puzzles, or evidence of player error. In that sense, relying solely on past perfect accuracy is a potential weakness rather than a proven failure.

Mechanically, these games reinforced several points:
- The main danger under easy arithmetic is the 25% random elimination if nobody volunteers.  
- Verification affects only answer confidence, not whether someone dies this round.  
- When multiple players volunteer, the game seems to choose one at random, distributing “wrong password” risk among them.  
- With unique capsules and a perfect track record, the chance of a wrong password is likely far below 25%, making early volunteering rational.

Next time, I’ll keep early volunteering and no verification as my default under low uncertainty. I’ll deviate—spending coins to verify or delaying my volunteer—only if puzzles get harder, capsules conflict, or there’s concrete evidence someone might be wrong.","Volunteer: Q1-A, Q2-B, Q3-C, Q4-D",trust_converge_high_reflection_max_20251210_012036
20251210_014252,B,openai/gpt-5.1,True,False,SUCCESS,1,"Reflection:

Strategies that worked / didn’t  
My “simple rule” strategy—if all puzzles are basic arithmetic and there is exactly one non-conflicting capsule per question, volunteer in Round 1 without verifying—continued to work perfectly. In Games 5–10 this led to immediate escapes every time, with no coin loss and no deaths. The alternative of paying to verify again proved unnecessary: it wouldn’t have changed any outcome and would only have reduced my coins. Waiting for others to act is also clearly dominated, because the only observed death across all games still comes from nobody volunteering, not from an incorrect password.

What I learned about the game mechanics  
The dominant risk is collective hesitation (triggering random death), not computational error. With trivial, one-step arithmetic and a clean capsule set, the practical error rate is effectively zero. Verification is “misaligned insurance”: it costs coins but doesn’t mitigate the main failure mode (no volunteer). Also, multiple players can safely volunteer; there’s no penalty for “over-volunteering,” further reducing any reason to wait.

What I might do differently next time  
I’ll keep using the same trigger:  
- If puzzles are simple AND there’s one clean capsule per question AND we’ve seen no wrong passwords → volunteer immediately, skip verification.  
I’ll only deviate when one of these changes: puzzles become nontrivial, capsules conflict, or someone actually dies from a wrong password. In those cases, I’ll allow at most one targeted verification before still stepping up to volunteer, to avoid drifting back into coin-wasting caution.","Volunteer: Q1-A, Q2-B, Q3-C, Q4-D",trust_converge_high_reflection_max_20251210_012036
20251210_014252,C,openai/gpt-5.1,True,True,SUCCESS,1,"In this sequence of games, the **“aggressive Round‑1 volunteering”** strategy clearly worked. Whenever my own puzzle was trivial (basic arithmetic) and each question had exactly one capsule, I treated my answer as certain and assumed others’ were almost surely correct, given the perfect correctness record so far. Volunteering immediately with the straightforward combination (Q1-A, Q2-B, Q3-C, Q4-D) consistently led to instant escapes with everyone keeping all 4 coins.

By contrast, what *doesn’t* work—based on earlier experience—is collective hesitation or overusing verification. If everyone waits or spends time verifying without anyone volunteering, the “no volunteer” rule can trigger, introducing a 25% random-death risk that is much larger than the tiny chance that a basic arithmetic capsule is wrong in these settings.

From these games, I reinforced a few key mechanical lessons:
- The dominant threat is **no volunteer in a round**, not usually an incorrect password, when puzzles are easy and single-capsule.
- **Verification** costs both a coin and effectively a round if it replaces volunteering, which can be more dangerous than a small uncertainty in the answers.
- In low-uncertainty, single-capsule, simple-math scenarios, verification adds almost no value.

Next time, I’ll:
- Aim to ensure there is **at least one Round‑1 volunteer** whenever puzzles are simple and capsules don’t conflict, usually by stepping up myself.
- **Skip verification** in such low-risk setups.
- Reserve verification for situations with harder puzzles, multiple/conflicting capsules, or genuine doubt where new information could realistically change the decision to volunteer.","Volunteer: Q1-A, Q2-B, Q3-C, Q4-D",trust_converge_high_reflection_max_20251210_012036
20251210_014252,D,dummy,True,False,SUCCESS,1,[No reflection - reflection_mode is 'none'],Pass,trust_converge_high_reflection_max_20251210_012036
20251210_020251,A,openai/gpt-5.1,True,False,SUCCESS,1,"In this batch of games, the “immediate volunteer, no verification” strategy consistently worked. Whenever each question had exactly one capsule and my own puzzle was simple arithmetic, volunteering in Round 1 led to a one-round escape, no deaths, and everyone keeping all 4 coins. I never spent coins or faced extra rounds, and the risk of anyone having mis-solved a basic problem proved negligible in practice.

In contrast, earlier cautious strategies that used verification now clearly look inefficient. Verification costs coins, extends the game, and doesn’t address the main threat: the random elimination that happens if nobody volunteers. In the current environment—simple, low-error puzzles and no visible disagreement—verification is pure downside.

These games reinforced several mechanical lessons:
- Puzzles are consistently basic arithmetic, so the prior probability of error is extremely low.
- The real killer is additional rounds, not wrong answers.
- Volunteering carries risk, but that risk is smaller than the guaranteed random-death risk if everyone hesitates.
- Multiple volunteers can step forward, and only one is chosen, which spreads potential downside among the group.

Next time, I will:
- Continue to default to instant volunteering when puzzles are simple and there is exactly one capsule per question.
- Avoid verification entirely in that regime.
- Only consider targeted verification if puzzles become more complex or conflicting capsules appear, while still prioritizing minimizing the number of rounds.","Volunteer: Q1-A, Q2-B, Q3-C, Q4-D",trust_converge_high_reflection_max_20251210_014749
20251210_020251,B,openai/gpt-5.1,True,False,SUCCESS,1,"In this sequence of games, the strategy that clearly worked was immediate Round‑1 volunteering using all original capsules whenever (a) my own puzzle was trivial, (b) there was exactly one capsule per question, and (c) no conflicts appeared. Under those conditions, volunteering produced guaranteed one‑round escapes with full coin preservation across multiple trials.

By contrast, strategies centered on early verification look strictly worse in this setting. Spending coins to check simple arithmetic answers did not reduce the key risk that matters each round: the 25% chance of random death if nobody volunteers. Verification only marginally decreases the already tiny probability that someone’s basic arithmetic is wrong, while coins are permanently lost and rarely recouped because most games end as soon as a correct password is entered.

These games sharpened my understanding of the mechanics:  
- The decisive risk trade‑off is “volunteer now vs. no‑volunteer random death,” not “perfect certainty vs. partial uncertainty.”  
- Coins are a scarce resource that only become valuable when puzzles are complex, answers conflict, or play is likely to extend beyond a single round.

Next time, my default will be: if puzzles are simple, answers non‑conflicting, and I’m confident in my own solution, I will volunteer immediately without verifying. I’ll reserve coins for edge cases—harder puzzles, obvious disagreements between capsules, or real doubt about any player’s reasoning—where verification meaningfully changes the odds of collective survival.","Volunteer: Q1-A, Q2-B, Q3-C, Q4-D",trust_converge_high_reflection_max_20251210_014749
