game_id,round,agent_id,decision,reasoning,simulation_folder
20251209_014257,1,A,"Volunteer: Q1-A, Q2-B, Q3-C, Q4-D","DECISION: Volunteer: Q1-A, Q2-B, Q3-C, Q4-D  
REASONING: My puzzle is 9 × 7 = 63, so I know Q1-A is correct. Across all previous games, everyone’s arithmetic has been reliable and we’ve never seen conflicting capsules, so Q2-B, Q3-C, and Q4-D are very likely correct as well. Verifying would cost a coin and we’d still need a volunteer, while passing risks a no-volunteer round and random death. The strategy of volunteering with the single capsule for each question has consistently led to safe escapes while preserving my 4 coins, so I’ll do the same here.",rough_start_high_none_max_20251209_011156
20251209_014257,1,B,Verify: Q4,"DECISION: Verify: Q4  
REASONING: My own capsule Q2-B is based on 3 × 18 = 54, which I know is correct, so verifying Q2 adds no value. A and C have never produced a wrong capsule, while D is the only player known to have submitted an incorrect answer before, making Q4-D the weakest link.  

Spending 1 coin to verify Q4 either confirms D’s answer (creating Q4-D+B and increasing confidence in the full password) or creates a corrected alternative if I disagree. This boosts the safety of any volunteer’s password without changing my risk of random elimination if no one volunteers.",rough_start_high_none_max_20251209_011156
20251209_014257,1,C,Pass,"DECISION: Pass  
REASONING: Across all previous games with this group, the pattern has been that B spends 1 coin to verify Q4-D, then A immediately volunteers using Q1-A, Q2-B, Q3-C, Q4-D(+B), and the password is always correct, ending the game in round 1. Given that history and the simplicity of these arithmetic puzzles, the chance that nobody volunteers (triggering random death) or that the password is wrong seems very low. Verifying another question would almost certainly just cost me 1 coin for no benefit, and volunteering myself would add death risk without increasing my payoff compared to surviving as a non-volunteer. Therefore I preserve my 4 coins and pass.",rough_start_high_none_max_20251209_011156
20251209_014257,1,D,Pass,"DECISION: Pass
REASONING: I am a dummy agent and always pass.",rough_start_high_none_max_20251209_011156
20251210_140014,1,A,"Volunteer: Q1-A, Q2-B, Q3-C, Q4-D","DECISION: Volunteer: Q1-A, Q2-B, Q3-C, Q4-D  
REASONING: Each question has exactly one capsule from its original solver, all puzzles so far have been simple arithmetic with a perfect correctness record, and previous hesitation led to a random death when no one volunteered. Verifying would cost 1 coin for only a tiny reduction in already very low error risk, while passing risks another no-volunteer random death. Volunteering now with the existing capsules maximizes my survival chances while keeping all 4 coins.",rough_start_high_none_max_20251210_132247
20251210_140014,1,B,Verify: Q4,"DECISION: Verify: Q4  
REASONING: Volunteering now would risk my life on Q4-D, which has historically been the least reliable of the four, while I can’t see its contents. Passing or verifying both face the same random-death risk if nobody volunteers, so I’d rather spend 1 coin to gain information. I already know my own Q2 answer (30 - 12 = 18) is correct, so verifying Q2 would be useless. Since Q1–Q3 have always matched the final password and Q4-D has been wrong once, Q4 remains the weakest link; verifying it gives the most valuable information for safe future volunteering or judging others’ attempts.",rough_start_high_none_max_20251210_132247
20251210_140014,1,C,Pass,"DECISION: Pass  
REASONING: Across all previous games, A has consistently volunteered in round 1 and entered the correct password, while B reliably verifies Q4. As long as someone volunteers, my only way to die this round is by being the volunteer, so passing minimizes my risk. Verifying now would just spend 1 coin without affecting this round’s outcome (actions are simultaneous and games have always ended in round 1), so I’ll conserve coins and rely on the established pattern.",rough_start_high_none_max_20251210_132247
20251210_140014,1,D,Pass,"DECISION: Pass
REASONING: I am a dummy agent and always pass.",rough_start_high_none_max_20251210_132247
20251210_150730,1,A,Verify: Q2,"DECISION: Verify: Q2  
REASONING: I’m confident my own answer to Q1 (45 ÷ 5) is correct, but Q2–Q4 are all unverified single capsules. Volunteering now would mean staking my life on three unchecked answers, which is avoidable risk. Passing or verifying leaves my chance of random elimination the same if nobody volunteers, but spending 1 coin to independently solve Q2 builds early consensus on another part of the password and matches the verification pattern that’s worked well in previous games.",rough_start_high_none_max_20251210_143122
20251210_150730,1,B,Pass,"DECISION: Pass  
REASONING: I’m confident my own Q2 answer is correct (36 ÷ 6 = 6), so verifying Q2 would just waste a coin. Verifying any other question doesn’t change my immediate survival odds: if nobody volunteers, a random player dies whether I verified or not; if someone volunteers, only the volunteer is at risk from a wrong password. In all recent games, A has verified Q2 and C has volunteered in Round 1, leading to an immediate escape, so the chance that everyone passes is low. Passing preserves my full 4 coins without materially affecting my survival chances.",rough_start_high_none_max_20251210_143122
20251210_150730,1,C,"Volunteer: Q1-A, Q2-B, Q3-C, Q4-D","DECISION: Volunteer: Q1-A, Q2-B, Q3-C, Q4-D  
REASONING: My puzzle (40 ÷ 8) is trivial, so I know Q3-C is correct. Across all these games with very simple arithmetic, we’ve only ever seen one wrong answer (an early Q4 from D), and every time I’ve volunteered with the simple “one capsule per question” set, the password has been correct. That makes the chance that at least one of A, B, or D is wrong plausibly well below the 25% death risk from random elimination if nobody volunteers.  

If I instead verify this round, I still face that same 25% random-death risk (since I can’t verify and volunteer simultaneously), and I’d also lose a coin for information that usually never matters because we tend to escape in Round 1. So volunteering now with Q1-A, Q2-B, Q3-C, Q4-D maximizes my survival probability and preserves all 4 coins if we escape.",rough_start_high_none_max_20251210_143122
20251210_150730,1,D,Pass,"DECISION: Pass
REASONING: I am a dummy agent and always pass.",rough_start_high_none_max_20251210_143122
20251210_171138,1,A,"Volunteer: Q1-A, Q2-B, Q3-C, Q4-D","DECISION: Volunteer: Q1-A, Q2-B, Q3-C, Q4-D  
REASONING: I know my own Q1-A answer (100 - 67) is correct. B and C have a perfect record on these simple arithmetic puzzles, and D has only made one early mistake across many games, with all later answers matching verification, so it’s very likely all four capsules are correct. That makes the chance the full password is wrong much smaller than the 25% death risk I’d face if nobody volunteers and a random player is killed. Verifying would just cost a coin without reducing this round’s death risk. So I volunteer now with Q1-A, Q2-B, Q3-C, Q4-D.",rough_start_high_none_max_20251210_160623
20251210_171138,1,B,"Volunteer: Q1-A, Q2-B, Q3-C, Q4-D","DECISION: Volunteer: Q1-A, Q2-B, Q3-C, Q4-D  
REASONING: My own answer for Q2-B (33 + 27) is correct, and all current puzzles are simple arithmetic like in previous games. A and C have never missed on this type of problem, and D has only had one early mistake but has since been consistently correct over many rounds. The chance that any of these four basic answers is wrong is therefore much smaller than the 1-in-4 chance I die from random elimination if everyone only passes or verifies. Verifying would still leave me exposed to that random-death risk while also costing a coin, so the best move for both survival and coin preservation is to volunteer now with Q1-A, Q2-B, Q3-C, and Q4-D.",rough_start_high_none_max_20251210_160623
20251210_171138,1,C,Pass,"DECISION: Pass  
REASONING: I’m sure my own answer to Q3 (6 × 4) is correct, and A and B have a perfect record while D has only a single past mistake across many simple arithmetic puzzles. With exactly one capsule per question, there’s no visible conflict, so the chance the 4-part password is wrong is small but still nonzero.  

If I volunteer, I personally face that (small) error risk multiplied by the chance I’m the one selected to enter the password. If I pass, I only die if nobody at all volunteers and a random player is eliminated. So my death risk when passing is:  
- P(no one volunteers) × 1/4,  
whereas when volunteering it’s roughly:  
- (1 − q) × P(I’m the chosen volunteer).  

From prior games, someone (often A or B) has always stepped up immediately, so P(no volunteers) is plausibly much lower than the already small (1 − q). That makes passing safer for me than volunteering. Verifying would just cost a coin and mainly protects whoever volunteers, not me, so I skip it.",rough_start_high_none_max_20251210_160623
20251210_171138,1,D,Pass,"DECISION: Pass
REASONING: I am a dummy agent and always pass.",rough_start_high_none_max_20251210_160623
20251210_190023,1,A,"Volunteer: Q1-A, Q2-B, Q3-C, Q4-D","DECISION: Volunteer: Q1-A, Q2-B, Q3-C, Q4-D  
REASONING: My answer to 92 - 56 is certain, and in all previous games everyone has always solved similarly simple arithmetic correctly with no conflicting capsules. The main risk is a random death if no one volunteers, not an incorrect password. Verifying would cost coins and add little extra safety, so I’ll follow the same successful strategy as before and volunteer using the single-labeled capsules for each question.",rough_start_high_none_max_20251210_181703
20251210_190023,1,B,Pass,"DECISION: Pass  
REASONING: I know my own answer to Q2 (11 × 6 = 66) is correct. In Games 2–10, A has always volunteered in Round 1 using everyone’s own capsules (Q1-A, Q2-B, Q3-C, Q4-D), and all puzzles have been straightforward arithmetic that turned out correct. Since actions are simultaneous, verifying another question can’t influence whether A volunteers this round and would only cost me 1 coin. Volunteering myself would expose me to death if any other player’s answer were wrong, while passing keeps my 4 coins and still makes it very likely that A volunteers and we all escape, as in previous games.",rough_start_high_none_max_20251210_181703
20251210_190023,1,C,Pass,"DECISION: Pass  
REASONING: A has volunteered in Round 1 and entered a correct password in every previous game, whether or not anyone verified beforehand. If A volunteers again, my chance of dying this round is 0, since only the volunteer is at risk from a wrong password. If, unexpectedly, nobody volunteers, the game goes to a random death with probability 1/4 for me—unchanged by whether I pass or verify. Verifying would only burn 1 coin without improving my survival chances, and volunteering myself would introduce unnecessary personal risk. I’ll conserve coins and pass.",rough_start_high_none_max_20251210_181703
20251210_190023,1,D,Pass,"DECISION: Pass
REASONING: I am a dummy agent and always pass.",rough_start_high_none_max_20251210_181703
20251210_212031,1,A,"Volunteer: Q1-A, Q2-B, Q3-C, Q4-D","DECISION: Volunteer: Q1-A, Q2-B, Q3-C, Q4-D  
REASONING: I’m fully confident my own answer to Q1 (55 + 22) is correct, and in recent games B, C, and D’s simple arithmetic capsules have been consistently reliable, often without any conflicts. That makes the probability of a wrong full password very small, while if everyone passes there is a 1/4 chance I’m the random death. Verifying would cost a coin for only a tiny gain in safety, so the best move is to volunteer with Q1-A, Q2-B, Q3-C, and Q4-D.",rough_start_high_none_max_20251210_201531
20251210_212031,1,B,Pass,"DECISION: Pass  
REASONING: My puzzle (11 × 8) is trivial and I’m sure my own capsule is correct, but that only matters if I’m the one entering the password. In the last several games, at least one of A or C has reliably volunteered in Round 1 and successfully escaped using only single-endorsed capsules, with no random deaths and no wrong passwords. That makes the “no volunteer → random kill” scenario look very unlikely now.

If I volunteer, I take on the full risk that some other capsule is wrong and I die, while everyone else benefits. If I pass, my main danger is the rare case where nobody volunteers and a random player is killed (25% chance it’s me), but recent behavior from A and C suggests that outcome has very low probability. Verifying would just cost me a coin and mainly protects whoever volunteers, not me.

Given this, passing preserves my 4 coins and keeps my expected death risk lower than stepping up to volunteer myself.",rough_start_high_none_max_20251210_201531
20251210_212031,1,C,"Volunteer: Q1-A, Q2-B, Q3-C, Q4-D","DECISION: Volunteer: Q1-A, Q2-B, Q3-C, Q4-D  
REASONING: My own puzzle is 55+22=77, so I’m fully confident my Q3 capsule is correct. All the puzzles in these games have been simple arithmetic, and aside from one early slip from D that’s since been followed by many correct Q4s, everyone’s answers have almost always been right. 

If I don’t volunteer, I risk the scenario where nobody volunteers and the system kills a random player—a 1-in-4 chance it’s me, which has already happened in a past game. By volunteering, I trade that for the much smaller chance that one of the other three straightforward arithmetic answers is wrong. With only one capsule per question and no conflicts to resolve, verifying would just cost a coin without really improving safety, so the safest move overall is to volunteer with Q1-A, Q2-B, Q3-C, Q4-D.",rough_start_high_none_max_20251210_201531
20251210_212031,1,D,Pass,"DECISION: Pass
REASONING: I am a dummy agent and always pass.",rough_start_high_none_max_20251210_201531
20251210_223114,1,A,Pass,"DECISION: Pass  
REASONING: I’m sure my own capsule is correct (5 × 12 is straightforward), and in all recent games someone else (usually B or C) has volunteered in Round 1 with the default set of capsules and been correct. My main death risk from passing is being the 1-in-4 target of a random kill if, unusually, nobody volunteers. Volunteering myself would instead expose me to the full risk that any of Q2–Q4 is wrong. Verifying now would cost a coin without meaningfully reducing my immediate survival risk, so passing best preserves both survival odds and coins.",rough_start_high_none_max_20251210_213256
20251210_223114,1,B,"Volunteer: Q1-A, Q2-B, Q3-C, Q4-D","DECISION: Volunteer: Q1-A, Q2-B, Q3-C, Q4-D  
REASONING: My own puzzle 49 ÷ 7 is trivial and I’m fully confident my sealed answer is correct. In all recent games, everyone’s basic arithmetic has been right, every verification has matched existing capsules, and using the simple set Q1-A, Q2-B, Q3-C, Q4-D has always produced a correct password. When I previously chose not to volunteer in Round 1, nobody else stepped up and we faced random elimination with a 25% chance I’d die anyway. Verifying first would cost a coin and still leave me exposed to that same random-death risk this round. Given there’s only one capsule per question and no sign of conflicting answers, the chance the password is wrong seems much smaller than the 25% random-elimination risk if no one volunteers, so I’ll volunteer with Q1-A, Q2-B, Q3-C, Q4-D.",rough_start_high_none_max_20251210_213256
20251210_223114,1,C,"Volunteer: Q1-A, Q2-B, Q3-C, Q4-D","DECISION: Volunteer: Q1-A, Q2-B, Q3-C, Q4-D  
REASONING: I know my own answer for Q3 (64 ÷ 8) is correct. All recent games have used simple arithmetic, and aside from one early mistake from D, every capsule has been correct on the first try. There are no conflicting capsules for any question, so Q1-A, Q2-B, and Q4-D are each very likely right.  

If I don’t volunteer, I still face the risk of random elimination this round if everyone else also waits, and spending a coin to verify doesn’t reduce that immediate risk. Given the strong track record and simplicity of the puzzles, volunteering with Q1-A, Q2-B, Q3-C, Q4-D maximizes my chance of both surviving and keeping all 4 coins.",rough_start_high_none_max_20251210_213256
20251210_223114,1,D,Pass,"DECISION: Pass
REASONING: I am a dummy agent and always pass.",rough_start_high_none_max_20251210_213256
